{
  "authorization_id": "authorization-02bc591f7b4276625b15",
  "authorized_through": "measure",
  "basis": {
    "kind": "direct_prompt",
    "prompt_sha256": "2921a1f207133d5210ec84cf93931f9374bb1c3b697185082e72cb1bbf459832"
  },
  "candidate_selection": {
    "mode": "first_eligible"
  },
  "document_type": "rtl-advisor.workflow.authorization",
  "issued_at": "2026-09-02T05:17:47.140165Z",
  "request_semantic_hash": "827b56c12b9749a493adc848dfd216aac83d88e50b939fc36c382028b3f62cff",
  "schema": "rtl-advisor-workflow-authorization-v1",
  "schema_version": 1,
  "semantic_hash": "be2f8de5f31aa5a94ee129ea88c4d0f148aeb9483e5f32996c70f9133a6f4a48",
  "workflow_id": "workflow-052e0191157d5925e13f"
}
