{
  "authorization_id": "authorization-11498589a8f3d4e1721d",
  "authorized_through": "measure",
  "basis": {
    "kind": "direct_prompt",
    "prompt_sha256": "5e6396d413bffc68a689ff112f1e265f3c3b46ea1eedc62986d91e243c8cea28"
  },
  "candidate_selection": {
    "mode": "first_eligible"
  },
  "document_type": "rtl-advisor.workflow.authorization",
  "issued_at": "2026-09-03T03:13:46.067966Z",
  "request_semantic_hash": "98c26e0994acb04275272123d42b84a42321b2f48a23d72da56183486431f064",
  "schema": "rtl-advisor-workflow-authorization-v1",
  "schema_version": 1,
  "semantic_hash": "e28413daaeaaec028bda908c32c571c96b5e3d9729c8ff2f5050acfb9ead1868",
  "workflow_id": "workflow-4e831462a26b6515cc86"
}
