{
  "authorization_id": "authorization-adbe1dd917a3c20c5c05",
  "authorized_through": "measure",
  "basis": {
    "kind": "direct_prompt",
    "prompt_sha256": "cf24fa70114734512d0d49938f4d4a40bf8a5f62a6be9c4eddee6cdd27c7d3c6"
  },
  "candidate_selection": {
    "mode": "first_eligible"
  },
  "document_type": "rtl-advisor.workflow.authorization",
  "issued_at": "2026-09-03T02:51:09.063726Z",
  "request_semantic_hash": "37b5b4c3510c754735c8dbe3fd4c93b91a29c6fc7d5303091e3f66ac7ba7299d",
  "schema": "rtl-advisor-workflow-authorization-v1",
  "schema_version": 1,
  "semantic_hash": "3032111a3646532091e8dafa13d8a596ca8dc2f9b72a2a33a4a66c4f1d0bd1b1",
  "workflow_id": "workflow-a4cbc92845fb7f1d143c"
}
