{
  "authorization_id": "authorization-4da8a584f336252459f9",
  "authorized_through": "measure",
  "basis": {
    "kind": "direct_prompt",
    "prompt_sha256": "5e6396d413bffc68a689ff112f1e265f3c3b46ea1eedc62986d91e243c8cea28"
  },
  "candidate_selection": {
    "mode": "first_eligible"
  },
  "document_type": "rtl-advisor.workflow.authorization",
  "issued_at": "2026-09-03T03:13:46.063724Z",
  "request_semantic_hash": "01110e3b268cbbe8797c89ad73c6b8bd3cd4c4223a528592743054075a2d5cb9",
  "schema": "rtl-advisor-workflow-authorization-v1",
  "schema_version": 1,
  "semantic_hash": "b3fad7669e8d1e2cf7b6fb74e98dff8337740fd146731d49eddbfe145db996be",
  "workflow_id": "workflow-dee432ed50a25645e0de"
}
