{
  "authorization_id": "authorization-ad11661281d821bdbb85",
  "authorized_through": "measure",
  "basis": {
    "kind": "direct_prompt",
    "prompt_sha256": "9aa16a086786d558d024d5204737a5fb6f29f81fa0b5b7930a4370f5505ecdbb"
  },
  "candidate_selection": {
    "mode": "first_eligible"
  },
  "document_type": "rtl-advisor.workflow.authorization",
  "issued_at": "2026-09-03T03:20:54.857666Z",
  "request_semantic_hash": "6a5a48f2b9dff7c2e5c72f37550892621bfb11133854ba83f373324e377cf35c",
  "schema": "rtl-advisor-workflow-authorization-v1",
  "schema_version": 1,
  "semantic_hash": "1a78c1feb671becb8dd739791ac2439202de10c3bcd4d550740fc05669aea372",
  "workflow_id": "workflow-5938e7b399e6835e608f"
}
