{
  "authorization_id": "authorization-3f657fe9bf7a097ab693",
  "authorized_through": "measure",
  "basis": {
    "kind": "direct_prompt",
    "prompt_sha256": "9aa16a086786d558d024d5204737a5fb6f29f81fa0b5b7930a4370f5505ecdbb"
  },
  "candidate_selection": {
    "mode": "first_eligible"
  },
  "document_type": "rtl-advisor.workflow.authorization",
  "issued_at": "2026-09-03T03:20:54.845293Z",
  "request_semantic_hash": "7aea4c7352b4451c659978c85ef72dadc5aecb87c85688b4184546fce3edd7cc",
  "schema": "rtl-advisor-workflow-authorization-v1",
  "schema_version": 1,
  "semantic_hash": "8ba7219250de11160568ed040530e1b8a1e88fd78cf3681b8b96a8120705bed4",
  "workflow_id": "workflow-aef4d54e031fed635cbe"
}
