{
  "authorization_id": "authorization-ab58a16f426040e73e89",
  "authorized_through": "measure",
  "basis": {
    "kind": "direct_prompt",
    "prompt_sha256": "cf24fa70114734512d0d49938f4d4a40bf8a5f62a6be9c4eddee6cdd27c7d3c6"
  },
  "candidate_selection": {
    "mode": "first_eligible"
  },
  "document_type": "rtl-advisor.workflow.authorization",
  "issued_at": "2026-09-03T02:51:09.108616Z",
  "request_semantic_hash": "372b0ca7f908456ae32f8a71e16fa6a3f246e6ba91f570a06f8a48b6890c5542",
  "schema": "rtl-advisor-workflow-authorization-v1",
  "schema_version": 1,
  "semantic_hash": "40f75550c7781101b7bde322fcff092d5043638acee5eb864ac8a29a915e3f77",
  "workflow_id": "workflow-553a161b235e2d7fe54f"
}
