{
  "authorization_id": "authorization-5ed6106acdc77caae159",
  "authorized_through": "measure",
  "basis": {
    "kind": "direct_prompt",
    "prompt_sha256": "9aa16a086786d558d024d5204737a5fb6f29f81fa0b5b7930a4370f5505ecdbb"
  },
  "candidate_selection": {
    "mode": "first_eligible"
  },
  "document_type": "rtl-advisor.workflow.authorization",
  "issued_at": "2026-09-03T03:20:54.841007Z",
  "request_semantic_hash": "98c26e0994acb04275272123d42b84a42321b2f48a23d72da56183486431f064",
  "schema": "rtl-advisor-workflow-authorization-v1",
  "schema_version": 1,
  "semantic_hash": "3713fc010611fb0727be5e7a74a152fcdc0c360243190819a2d33f77c5cea520",
  "workflow_id": "workflow-4e831462a26b6515cc86"
}
