{
  "authorization_id": "authorization-36adb9cdefaa1321ca2d",
  "authorized_through": "measure",
  "basis": {
    "kind": "direct_prompt",
    "prompt_sha256": "2921a1f207133d5210ec84cf93931f9374bb1c3b697185082e72cb1bbf459832"
  },
  "candidate_selection": {
    "mode": "first_eligible"
  },
  "document_type": "rtl-advisor.workflow.authorization",
  "issued_at": "2026-09-02T05:16:08.695459Z",
  "request_semantic_hash": "01110e3b268cbbe8797c89ad73c6b8bd3cd4c4223a528592743054075a2d5cb9",
  "schema": "rtl-advisor-workflow-authorization-v1",
  "schema_version": 1,
  "semantic_hash": "6b13a8dee9d0dcaa25f98ef406759b82e99502d8a3d3a53b20206570c3069e54",
  "workflow_id": "workflow-dee432ed50a25645e0de"
}
