{
  "authorization_id": "authorization-f2fa0b8720a7a81f62b9",
  "authorized_through": "measure",
  "basis": {
    "kind": "direct_prompt",
    "prompt_sha256": "5e6396d413bffc68a689ff112f1e265f3c3b46ea1eedc62986d91e243c8cea28"
  },
  "candidate_selection": {
    "mode": "first_eligible"
  },
  "document_type": "rtl-advisor.workflow.authorization",
  "issued_at": "2026-09-03T03:13:46.017076Z",
  "request_semantic_hash": "d14b14d54ef4621df7ab6ddd7333f7c167cdf9df673583c835c38b75b8180019",
  "schema": "rtl-advisor-workflow-authorization-v1",
  "schema_version": 1,
  "semantic_hash": "06dffb9feb992b6dcec07e6bf6958439be6675653e5c18bca6154c3f413e5db1",
  "workflow_id": "workflow-6eb04148ae3e719a40a5"
}
