{
  "authorization_id": "authorization-95b1d0ce1d54bf0a13a5",
  "authorized_through": "measure",
  "basis": {
    "kind": "direct_prompt",
    "prompt_sha256": "cf24fa70114734512d0d49938f4d4a40bf8a5f62a6be9c4eddee6cdd27c7d3c6"
  },
  "candidate_selection": {
    "mode": "first_eligible"
  },
  "document_type": "rtl-advisor.workflow.authorization",
  "issued_at": "2026-09-03T02:51:09.053728Z",
  "request_semantic_hash": "fea5ffbe42c95f3307a41f30dd59bbf5617d105e555f6153bdaa632ef5bbbcdd",
  "schema": "rtl-advisor-workflow-authorization-v1",
  "schema_version": 1,
  "semantic_hash": "2f204fea15a6505dbe3f0eb4f1b29063021b2b5e750c33128f2ef9afbd97802d",
  "workflow_id": "workflow-1e643cd606ac4b87ae06"
}
